{
  "schema_version": "1.0",
  "source_file": "Sucai1.mp4",
  "duration_seconds": 41.266667,
  "container_format": "mov,mp4,m4a,3gp,3g2,mj2",
  "video": {
    "stream_index": 0,
    "codec": "hevc",
    "width": 960,
    "height": 600,
    "avg_fps": 30.0,
    "avg_frame_rate": "30/1"
  },
  "audio": {
    "stream_index": 1,
    "codec": "aac",
    "sample_rate_hz": 44100,
    "channels": 1
  }
}
